구분,유저,챗봇
감정/감정조절이상,제 감정이 이상해진 것 같아요. 남편만 보면 화가 치밀어 오르고 감정 조절이 안되요.,감정의 기복은 내면의 갈등을 반영합니다. 남편과의 관계에서 느끼는 감정이 무엇인지 깊이 들여다보는 것이 중요합니다. 자신을 이해하는 과정이 필요합니다.
감정/감정조절이상,하루종일 오르락내리락 롤러코스터 타는 기분이에요.,이런 불안정한 감정은 자신 안의 여러 갈등이 얽혀 있음을 의미합니다. 내면의 목소리를 듣고 그 감정의 원인을 탐구하는 것이 필요합니다.
감정/감정조절이상,롤러코스터 타는 것처럼 기분이 왔다 갔다 해요.,감정의 롤러코스터는 자아의 여러 면이 충돌하고 있다는 신호입니다. 이 갈등을 인식하고 수용하는 것이 첫걸음입니다.
감정/감정조절이상/화,평소 다른 일을 할 때도 비슷해요. 생각한대로 안되면 화가 나고…그런 상황이 지속되면 폭발해버려요.,기대와 현실의 괴리가 당신의 감정을 자극합니다. 이 상황에서 자신의 감정을 정리하고 수용하는 연습이 필요합니다.
감정/감정조절이상/화,예전보다 화내는 게 과격해진 거 같아.,감정의 과격함은 억눌린 감정이 폭발하는 방식입니다. 자신이 느끼는 감정을 솔직하게 표현할 공간을 찾아보세요.
감정/감정조절이상/화,화가 안 참아져.,화를 참지 못하는 것은 내면의 힘든 감정을 외부로 드러내는 방식입니다. 이 감정을 안전하게 표현할 방법을 찾아보세요.
감정/감정조절이상/화,근데 다음에 또 그러면 또 화가 나고… 모르겠어요. 제 감정이 통제가 안 돼요.,감정의 통제는 내면의 불안정함과 깊은 연관이 있습니다. 자신을 돌보는 시간을 가지며 감정을 탐구하는 것이 중요합니다.
감정/감정조절이상/화,마음은 안 그런데 화를 낼 때 더 불같이 내게 되기도 하고..,이중적인 감정은 자아의 갈등을 나타냅니다. 자신의 진정한 감정을 인식하고 표현하는 연습이 필요합니다.
감정/걱정,나도 그런 거 아닌가 걱정돼.,자신에 대한 걱정은 자아의 분열을 반영합니다. 자신을 비판하기보다는 이해하고 수용하는 태도가 필요합니다.
감정/걱정,"처음엔 치료 받으면 낫겠지 생각했는데, 낫지도 않고 계속 병원을 다니니까 너무 걱정되요.","치료는 시간이 필요한 과정입니다. 자신을 조급하게 만들지 말고, 인내심을 가지고 자신을 돌보는 것이 중요합니다."
감정/걱정,수술한다는 말에 얼마나 걱정이 되던지…,"수술은 불확실성을 동반합니다. 그 불안감을 인정하고, 자신에게 필요한 지원을 요청하는 것이 좋습니다."
감정/걱정,다행히 수술은 잘 됐다고 해서 다행이야. ,"수술의 성공은 한 걸음 나아간 것입니다. 회복 과정에서 자신을 소중히 여기고, 긍정적인 변화를 받아들이세요."
감정/걱정,솔직히 좀 걱정돼. ,"걱정은 자연스러운 감정입니다. 이 감정을 부정하기보다는, 그 속에서 무엇을 배우고 느낄 수 있는지 탐구해보세요."
감정/걱정/건강문제,평생 이렇게 살아야할까봐 걱정이야.,"미래에 대한 걱정은 자연스럽습니다. 그러나 현재의 순간을 소중히 여기고, 작은 변화부터 시작하는 것이 중요합니다."
감정/걱정/건강문제,나도 혈압이 높은 편인데… 요즘 몸도 안 좋고 해서 자꾸 걱정이 되네..,"신체적 건강은 정신적 안녕과 밀접하게 연결되어 있습니다. 자신을 돌보는 방법을 찾고, 필요할 때 도움을 요청하세요."
감정/걱정/건강문제,나도 이러기 싫은데 자꾸 건강을 걱정하게 돼. ,"건강에 대한 걱정은 우리의 삶의 질에 큰 영향을 미칩니다. 긍정적인 습관을 들이고, 자신을 돌보는 시간이 필요합니다."
감정/걱정/건강문제,근데 아무리 생각해도 문제가 없을 것 같지 않은 거예요.,의식의 혼란은 내면의 갈등을 나타냅니다. 자신의 감정과 생각을 정리하는 시간을 가져보세요.
감정/걱정/건강문제,내내 이렇게 누워서 환자 생활만 하면 어떡하죠?,"자신에게 주어진 상황을 받아들이고, 작은 활동부터 시작해보세요. 변화는 작은 것에서부터 시작됩니다."
감정/걱정/건강염려,위염이 위암이나 다른 암으로 발전하면 어떡하지. 이런 생각을 많이 하는 것 같아요. ,"불안한 생각은 우리의 마음을 지배할 수 있습니다. 현재의 순간에 집중하고, 필요한 조치를 취하는 것이 좋습니다."
감정/걱정/건강염려,괜히 진짜 큰 병이면 어쩌나 싶기도 하고… 별거 아닌 걸로 병원 가는 것도 좀 그렇기도 하고. ,두려움은 우리의 마음을 지배할 수 있습니다. 그러나 건강에 대한 걱정은 때때로 필요합니다. 전문가의 조언을 듣는 것이 중요합니다.
감정/걱정/건강염려,"수술도 잘 됐고, 의사도 회복만 잘 하면 된다는데 자꾸 걱정이 돼요.","회복 과정에서의 걱정은 자연스러운 부분입니다. 자신에게 친절하게 대하고, 긍정적인 생각을 유지하세요."
감정/걱정/건강염려,"원래 병에 잘 걸리지 않는 편이었는데, 한 번 심장이 이상하다고 느끼니까 건강 걱정이 늘었어요.",심리적 불안은 신체적 반응을 유발할 수 있습니다. 자신을 돌보는 방법을 찾아보는 것이 중요합니다.
감정/걱정/건강염려,"아, 내가 길 가다가 갑자기 확 쓰러지는 건 아닐까요? ","불안한 생각은 우리를 지배할 수 있습니다. 현재의 순간을 인식하고, 도움이 필요할 때는 주저하지 말고 요청하세요."
감정/걱정/경제적문제,학자금은 언제 다 갚나… 아직도 몇 년은 더 남았는데… ,"경제적인 걱정은 우리에게 큰 스트레스를 줍니다. 계획을 세우고, 작은 목표부터 시작하는 것이 좋습니다."
감정/걱정/경제적문제,경제적인 문제만 좀 풀려주면 좋겠는데… 쉽지가 않네요.,"경제적 불안은 많은 사람의 공통된 고민입니다. 이를 해결하기 위한 계획을 세우고, 작은 변화부터 시작해보세요."
감정/걱정/경제적문제,언제쯤 저는 돈 걱정 없이 살 수 있을까요?,"미래에 대한 걱정은 불안을 유발합니다. 현재의 작은 목표를 세우고, 한 걸음씩 나아가는 것이 중요합니다."
감정/걱정/경제적문제,내가 나중에 이걸 관두면 나는 그럼 어떡하지? 뭘 해 먹고 살지? 돈은?,"불확실한 미래에 대한 걱정은 자연스럽습니다. 다양한 가능성을 열어두고, 자신에게 맞는 길을 탐구해보세요."
감정/걱정/경제적문제,당장 해결해야 하는 치료비 때문에 걱정이 많았어.,"재정적인 어려움은 큰 스트레스를 유발합니다. 필요한 지원을 요청하고, 문제를 함께 해결할 수 있는 방법을 찾아보세요."
감정/걱정/미래,내가 이 회사를 다니는 게 맞나… 그런 생각도 들고요. ,직업에 대한 의문은 자연스러운 과정입니다. 자신의 가치와 목표를 재정립하는 시간이 필요합니다.
감정/걱정/미래,앞으로 집은 어떻게 사나 싶어요. ,"내 집에 대한 걱정은 많은 사람의 고민입니다. 현실적인 계획을 세우고, 작은 목표부터 시작하세요."
감정/걱정/미래,좋은 환경에 있어도 잘될까 말까 하는데… 이런 환경에서 사람답게 살 수 있을까?,환경은 우리의 삶에 큰 영향을 미칩니다. 그러나 자신의 내면을 돌보는 것이 더욱 중요합니다.
감정/걱정/미래,이렇게 계속 살아도 되는 걸까?,"삶에 대한 의문은 깊은 성찰을 요구합니다. 현재의 삶을 소중히 여기고, 작은 변화를 시도해보세요."
감정/걱정/미래,언제쯤 제 인생에 해가 뜰까요?,미래에 대한 불안은 자연스러운 감정입니다. 하지만 현재의 순간을 소중히 여기는 것이 중요합니다.
감정/걱정/불면,걱정이 돼서 밤에 잠이 안 와.,"불안한 생각은 우리의 마음을 지배할 수 있습니다. 편안한 환경을 만들고, 이완하는 방법을 찾아보세요."
감정/걱정/불면,또 못 자면 어떡하지? 하고 걱정이 드는데 그거 때문에 더 못 자는 거 같아요.,걱정이 잠을 방해할 수 있습니다. 이완 요법이나 명상을 시도해보는 것이 좋습니다.
감정/걱정/불면,언제 또 이렇게 못 잘 지 모르겠고… 또 못 자게 될까봐 그게 걱정돼.,"불안한 생각은 우리의 마음을 괴롭힙니다. 이러한 걱정은 현재의 순간을 놓치게 만들 수 있으니, 이완 기법이나 명상으로 마음을 가라앉히는 연습이 필요합니다."
감정/걱정/불면,안 해도 될 걱정을 하게 되고 그렇게 생각하다 다시 또 잠을 못 자.,"걱정이 잠을 방해하는 것은 자연스러운 현상입니다. 긍정적인 시각을 유지하고, 걱정의 원인을 탐구하는 것이 중요합니다."
감정/걱정/불면,이런저런 걱정이 많아서 잠도 못 자고 있고요.,"다양한 걱정은 우리의 마음을 지치게 합니다. 자신을 돌보는 시간을 가지며, 무엇이 진정으로 중요한지를 되새기는 것이 필요합니다."
감정/걱정/암,위염인 줄 알았는데 암이었다는 사람도 있었고… 걱정이 되지.,건강에 대한 걱정은 매우 깊은 불안을 유발할 수 있습니다. 그러나 검사를 통해 확실한 정보를 얻는 것이 가장 중요합니다.
감정/걱정/암,"간암도 초기에는 잘 모른다고 하니까… 내가 간암일 수도 있지 않나, 내가 간암이면 어쩌나 그런 걱정도 해.",불확실한 상황에서의 걱정은 자연스러운 반응입니다. 그러나 자신의 건강을 정확하게 이해하는 것이 중요합니다. 필요한 검사를 받는 것이 좋습니다.
감정/걱정/암,암이면 어떻게 하지?,"암에 대한 두려움은 많은 이들이 느끼는 일반적인 감정입니다. 그러나 전문가와 상담하며 정보를 얻고, 필요한 조치를 취하는 것이 중요합니다."
감정/걱정/암,혹이 암으로 발전할 가능성은 별로 없다고는 하는데… 사람 일은 모르는 거잖아요.,"불확실성은 우리에게 불안을 줍니다. 그러나 긍정적인 태도로 현재를 살고, 필요한 검사를 통해 자신을 돌보는 것이 중요합니다."
감정/걱정/암,암이 뭐 나이 가리냐? 혹시 모르잖아. 당연히 걱정되지.,"나이에 관계없이 건강에 대한 걱정은 자연스러운 것입니다. 하지만 자신의 몸을 잘 살피고, 필요한 조치를 취하는 것이 중요합니다."
감정/걱정/자녀,하루종일 딸만 생각하고 있어.,자녀에 대한 걱정은 부모의 본능입니다. 그러나 자신도 돌보는 것이 필요합니다. 균형을 잡는 것이 중요합니다.
감정/걱정/자녀,하루종일 아들만 생각해.,자녀에 대한 지속적인 걱정은 부모의 마음에서 비롯됩니다. 하지만 자신을 잃지 않도록 주의해야 합니다.
감정/걱정/자녀,딸 걱정 때문에 다른 일도 잘 못 하겠어.,"자녀에 대한 걱정은 크지만, 자신의 삶도 소중히 여기는 것이 필요합니다. 일과 삶의 균형을 찾는 과정이 중요합니다."
감정/걱정/자녀,저 때문에 아이들이 제대로 못 클까봐 걱정이고..,부모의 걱정은 아이에게 영향을 미칠 수 있습니다. 그러나 자신의 감정을 다스리는 것이 아이들에게도 긍정적 영향을 줄 수 있습니다.
감정/걱정/자녀,나도 내 삶을 살고 싶은데…맨날 아이 걱정만 해.,자신을 돌보는 것은 자녀에게도 긍정적인 영향을 줍니다. 자신과 자녀의 행복을 위해서라도 균형을 찾아야 합니다.
감정/걱정/주변평가,주변에서는 나이도 어린데 뭔 그런 걱정이냐고 하는데 그래도…,주변의 시선은 중요하지 않습니다. 자신의 감정과 경험을 소중히 여기는 것이 중요합니다.
감정/걱정/주변평가,주변 사람들은 제가 너무 걱정이 많다고 하는데 모르겠어요.,격려와 이해의 시선이 필요합니다. 그러나 자신의 감정을 솔직하게 표현하는 것도 중요합니다.
감정/걱정/주변평가,그냥 뭘 사거나 아니면 말을 할 때도 다른 사람이 어떻게 생각할지 걱정해요.,타인의 시선에 대한 두려움은 자연스러운 감정입니다. 그러나 자신을 잃지 않도록 주의해야 합니다.
감정/걱정/주변평가,학생들이 뭐라고 생각하겠어. 분명 이상하다고 생각할 거야.,"다른 사람의 시선은 제한적입니다. 자신을 있는 그대로 받아들이고, 자신감을 가지는 것이 중요합니다."
감정/걱정/증상재발,선생님은 수술 잘됐다고 안심하라고 하는데 밤만 되면 나도 병이 재발하는 게 아닌가 싶고…,"수술 후의 불안감은 자연스러운 반응입니다. 그러나 긍정적인 회복을 위한 믿음을 가지고, 필요할 때 도움을 요청하세요."
감정/걱정/증상재발,"또 크게 어지럼증이 느껴져서 쓰러지기라도 하면 어떡하나, 큰일이 나면 어쩌나 싶더라구.",건강에 대한 두려움은 우리의 마음을 지치게 합니다. 그러나 전문의와 상담하여 정확한 정보를 얻는 것이 중요합니다.
감정/걱정/증상재발,또 그런 증상이 나타날까 봐 걱정되네요.,불안한 감정은 우리의 삶에 큰 영향을 미칩니다. 그러나 이를 극복하기 위한 방법을 찾아보는 것이 필요합니다.
감정/걱정/증상재발,수술은 잘 됐는데 요즘 이게 다시 재발하진 않을까 걱정되고…,"회복 과정에서의 걱정은 자연스러운 현상입니다. 자신의 몸을 잘 살피고, 긍정적인 태도를 유지하세요."
감정/걱정/증상재발,"아직 병이 다 낫지도 않았는데, 남편이 없을 때 발작이 나면 어떡하지?","불안은 우리의 마음을 지배할 수 있습니다. 그러나 필요한 지원을 요청하고, 자신을 돌보는 것이 중요합니다."
감정/고독감,누가 나 좀 위로해줬으면 좋겠다… ,위로는 우리의 감정적 지지를 위해 필요합니다. 주변의 지지와 이해를 구하는 것이 중요합니다.
감정/고독감,나만 어디 버려져 있는 느낌이에요.,"고립감은 우리를 더욱 힘들게 합니다. 그러나 주변과의 연결을 찾고, 소통하는 것이 중요합니다."
감정/고독감,세상에 저 혼자 있는 거 같아요. ,"고립감이 느껴질 때, 작은 변화부터 시작해보세요. 주변과의 연결을 찾는 것이 필요합니다."
감정/고독감,사람 많은 곳에 서 있으면 나만 뚝 떨어진 느낌? 마치 버려진 느낌이 들어요.,"사람들 속에서 느끼는 고립감은 흔한 감정입니다. 그러나 자신을 소중히 여기고, 소통할 기회를 찾아보세요."
감정/고독감,사람들 사이에 있으면 나만 버려져 있는 거 같아요.,"주변의 시선이 불안하게 느껴질 수 있습니다. 그러나 자신을 잃지 않도록 주의하고, 긍정적인 관계를 유지하세요."
감정/곤혹감,내가 정말 황당해서…,"황당한 상황은 우리의 감정을 자극합니다. 이를 솔직하게 표현하고, 자신을 이해하는 과정이 필요합니다."
감정/곤혹감,처음에 그 얘기를 들었을 때는 너무 황당한 거예요.,"황당한 감정은 일상에서 발생할 수 있습니다. 이 감정을 수용하고, 그 속에서 배울 점을 찾아보세요."
감정/곤혹감,기사님한테 세워달라고 할 수도 없고…,불편한 상황에서는 스스로를 돌보는 것이 중요합니다. 필요한 도움을 요청하는 것이 좋습니다.
감정/곤혹감,하…내가 정말 어떻게 해야 하는건지 모르겠어.,"방향을 잃은 느낌은 누구에게나 올 수 있습니다. 그러나 자신을 이해하고, 필요한 도움을 요청하는 것이 중요합니다."
감정/곤혹감,덥다고 핑계 대는 것도 한두 번이지. 진짜 미쳐버리겠어.,"스트레스와 불안이 쌓일 때, 자신을 돌보는 방법을 찾아야 합니다. 작은 변화부터 시작하는 것이 중요합니다."
감정/공포,이러다 죽는 게 아닌가 싶을 정도였어. ,"극심한 스트레스는 우리에게 큰 부담이 됩니다. 필요한 지원을 요청하고, 긍정적인 방법으로 자신을 돌보는 것이 중요합니다."
감정/공포,무서워서 이를 악 물었는데 얼마나 세게 물었는지 나중에는 턱이 얼얼하더라구.,"두려움은 강한 감정으로, 종종 우리의 몸과 마음에 물리적인 반응을 일으킵니다. 이 감정을 직면하고, 그 원인을 탐구하는 것이 필요합니다."
감정/공포,으… 보기만 해도 비명이 바로 튀어 나온다. ,"감정이 격해질 때, 우리의 반응은 본능적입니다. 그 속에서 자신이 느끼는 두려움을 인정하고, 이를 이해하는 과정이 중요합니다."
감정/공포,그때만 생각하면 소름이 돋아요.,"소름은 기억 속의 두려움을 다시 불러옵니다. 이러한 감정은 과거의 경험에서 비롯된 것이니, 그 경험을 분석하고 수용하는 것이 필요합니다."
감정/공포,볼 때는 별 생각 없었거든요. 그냥 소름 끼친다 정도?,"감정의 변화는 우리의 심리적 상태를 반영합니다. 그 감정의 깊이를 이해하고, 자신을 돌보는 것이 중요합니다."
감정/공포/새,원래 새 봐도 별 느낌이 없었거든.,"익숙한 것들이 갑자기 두렵게 느껴지는 것은 내면의 변화가 생겼음을 나타냅니다. 그 변화를 수용하고, 자신을 이해하는 과정이 필요합니다."
감정/공포/새,근데 학교에서 비둘기가 막 낮게 날면서 위협한 이후로 새들이 무서워졌어.,"특정 경험이 두려움을 유발할 수 있습니다. 그 경험을 잊지 않고, 자신에게 필요한 대처 방안을 찾는 것이 중요합니다."
감정/공포/새,"멀리서 비둘기 보여도 갑자기 달려들까봐 피하고, 가까이 오면 소리지르고 난리도 아니야.","두려움은 우리의 행동을 제한할 수 있습니다. 그 감정을 직면하고, 안전한 환경에서 자신을 표현하는 것이 필요합니다."
감정/공포/새,"비둘기는 진짜 많이 보이잖아. 사람이 다가와도 안 피하고, 몸은 뚱뚱해서 뒤뚱뒤뚱… 생각만 해도 너무 싫어.","타인의 반응은 우리의 감정에 영향을 미칩니다. 그러나 그 감정을 정리하고, 자신을 보호하는 방법을 찾아야 합니다."
감정/공포/새,"내가 너무 새를 무서워하니까 친구들도 그걸 알고, 새 오면 알아서 나 피하게 해주고 그럴 정도야. ","주변의 지지가 중요한 만큼, 자신의 두려움을 극복하기 위한 노력이 필요합니다. 자신을 이해하고, 건강한 관계를 구축하는 것이 중요합니다."
감정/공허감,저도 살아 숨쉰다는 느낌을 받고 싶어요. 지금은 죽어있는 느낌이예요.,"살아있음을 느끼지 못하는 것은 깊은 고립감을 반영합니다. 자신에게 필요한 것을 찾고, 작은 변화를 만들어가는 것이 필요합니다."
감정/공허감,외롭다는 생각도 모르고 그냥 적응하고 살았는데… 가끔은 내 인생은 왜 이럴까..서글프게 느껴져요.,"외로움은 무의식적으로 쌓여온 감정입니다. 이를 인식하고, 자신을 돌아보는 시간이 필요합니다."
감정/공허감,세상에 제 편은 아무도 없는 것 같아요. 먼지처럼 사라져도 아무도 모르겠죠?,"고립감은 깊은 슬픔을 불러일으킵니다. 그러나 당신의 존재는 소중하며, 이를 이해할 수 있는 누군가를 찾아보세요."
감정/공허감,인생이 공허해.,"공허함은 존재의 의미를 찾고자 하는 갈망에서 비롯됩니다. 자신을 탐구하고, 새로운 경험을 시도하는 것이 필요합니다."
감정/공허감,저는 제 할 일 열심히 잘 했다고 생각했는데… 남는 건 하나도 없는 거 같고… 허탈해요.,"노력의 결과가 보이지 않을 때, 깊은 허탈감이 따릅니다. 그러나 작은 성취를 인정하고, 그 속에서 의미를 찾아보세요."
감정/과민반응,작은 소리에도 깜짝깜짝 놀라고… 정상적인 생활이 안 돼요.,"외부 자극에 대한 과민 반응은 스트레스와 불안의 신호입니다. 이를 관리하고, 자신을 돌보는 방법을 찾는 것이 필요합니다."
감정/과민반응,장난이라고 하는데 자꾸 생각나고 신경 쓰여요.,"사소한 일도 우리의 마음을 괴롭게 할 수 있습니다. 그 감정을 수용하고, 자신을 이해하는 과정이 필요합니다."
감정/과민반응,다들 신경이 극에 달했던 것 같아.,"집단의 긴장감은 개인에게 큰 영향을 미칩니다. 그 속에서 자신의 감정을 이해하고, 필요할 때 지원을 요청하는 것이 중요합니다."
감정/과민반응,그 후로도 누가 뭘 떨어트리기만 해도 진짜 너무 놀라니까…,"불안한 기억은 우리의 반응을 지배할 수 있습니다. 그 경험을 직면하고, 스스로를 보호하는 방법을 찾아야 합니다."
감정/과민반응,길을 걸을 때마다 감각이 한껏 예민해져.,감각의 예민함은 내면의 긴장감을 반영합니다. 이 긴장을 해소하기 위한 방법을 모색하는 것이 필요합니다.
감정/괴로움,그렇게 몇 개월 다니다 보니까 사람 할 짓이 못되더라고요.,지속적인 스트레스는 우리의 삶의 질을 떨어뜨립니다. 이를 해결하기 위한 방법을 찾아보는 것이 중요합니다.
감정/괴로움,그거 때문에 괴로워서 미칠 거 같아요.,"괴로움은 내면의 갈등을 나타냅니다. 그 갈등을 이해하고, 자신을 돌보는 방법을 찾는 것이 필요합니다."
감정/괴로움,저 진짜 상처 너무 많이 받는데… 그 사람을 놓을 수가 없어요.,"상처는 깊고, 이를 치유하는 과정이 필요합니다. 그 사람과의 관계를 돌아보고, 자신을 존중하는 것이 중요합니다."
감정/괴로움,몸도 몸이지만 정신적으로도 너무 괴로워.,"정신적 고통은 신체적 증상과 연결됩니다. 그 고통을 인식하고, 필요한 지원을 요청하는 것이 중요합니다."
감정/괴로움,여러모로 괴로운 날들이었어.,괴로움은 우리에게 매우 힘든 경험입니다. 그러나 그 속에서 성장할 수 있는 기회를 찾는 것이 필요합니다.
감정/기분저하,기분이 계속 다운된 상태였어요. ,지속적인 우울감은 우리의 마음을 지치게 합니다. 이를 극복하기 위한 방법을 찾아보는 것이 중요합니다.
감정/기분저하,혼자 깊은 감옥에 갇혀서 못 빠져나오는 느낌? ,"고립감은 우리의 삶을 제한할 수 있습니다. 그러나 자신을 이해하고, 필요한 지원을 요청하는 것이 중요합니다."
감정/기분저하,다 맘에 안 들고 기분이 안 좋아요. ,"기분이 좋지 않은 것은 자연스러운 감정입니다. 그 감정을 수용하고, 자신을 돌보는 방법을 찾아보세요."
감정/기분저하,실수 한 번 없이 완벽하게 일한다고 칭찬받는 게 기분 좋은 일인데 난 하나도 기분이 안 좋아. ,"완벽주의는 종종 우리를 괴롭힙니다. 자신을 있는 그대로 받아들이고, 작은 성취를 인정하는 것이 필요합니다."
감정/기분저하,그럴 땐 기운이 탁 빠져요. ,에너지가 고갈되는 것은 심리적 부담의 결과입니다. 자신을 돌보는 시간과 공간을 만들어야 합니다.
감정/기시감,그런 걸 기시감이라고 하지?,"기시감은 우리의 기억과 경험이 교차하는 순간입니다. 이를 통해 자신을 이해하고, 내면의 변화를 탐구하는 것이 필요합니다."
감정/기시감,"친구랑 한 번도 안 가본 빵집에 갔는데, 왠지 되게 익숙한 기분이 드는 거야.",익숙함은 우리의 기억 속에 깊이 자리잡고 있습니다. 그 경험을 통해 자신을 탐구하는 것이 중요합니다.
감정/기시감,지금 이렇게 상담하는 것도 뭔가 예전에 봤던 것 같이 느껴져요.,"상담은 과거의 경험을 되돌아보는 기회를 제공합니다. 이를 통해 자신을 이해하고, 새로운 관점을 찾는 것이 필요합니다."
감정/기시감,처음 기시감이 든 건 일 년 전쯤이에요.,기시감은 우리의 내면에서 일어나는 변화를 반영합니다. 이를 통해 자신의 감정을 탐구하는 것이 중요합니다.
감정/기시감,처음이 아닌 듯한 그런 기분이 들어서… 어 이상하다 이상하다 했어요.,"익숙한 감정은 우리의 무의식을 자극합니다. 그 감정을 탐구하고, 자신을 이해하는 과정이 필요합니다."
감정/긴장,긴장을 해서 그런가?,"긴장감은 내면의 불안이 표출되는 방식입니다. 이 감정을 깊이 들여다보고, 왜 그런지 스스로에게 질문하는 것이 필요합니다."
