구분,유저,챗봇
감정/힘듦/지침,그 짓도 한두 번이지…,"반복적인 스트레스는 우리의 마음을 지치게 할 수 있습니다. 이 감정을 수용하고, 필요한 지원을 요청하는 것이 중요합니다."
감정/힘듦/지침,이제 저도 한계가 온 거 같아요.,"한계에 다다르는 느낌은 깊은 고통을 반영합니다. 이 감정을 인식하고, 필요한 지원을 요청하는 것이 중요합니다."
내원이유/상담,정말 뭔 이상이 있는 것 같아서 일단 병원 와봤어요.,"자신의 감정을 이해하고, 전문가의 도움을 받는 것은 중요한 첫 걸음입니다. 필요한 지원을 요청하는 것이 중요합니다."
내원이유/상담,그래서 이거 상담 차 한 번 와봤어요.,"상담은 자신의 감정을 탐구하고, 치유의 과정을 시작하는 좋은 방법입니다. 필요한 지원을 요청하는 것이 중요합니다."
내원이유/상담,사실 이 상담도 돈 아까웠는데 그래도 혹시 하는 맘에 와봤어요.,상담에 대한 망설임은 자연스러운 감정입니다. 그러나 자신의 감정을 이해하는 데 큰 도움이 될 수 있습니다.
내원이유/상담,쭉 이러다 보면 정말 자살할 것 같아서 상담 받으려고 와봤어요.,"극단적인 생각은 깊은 고통을 반영합니다. 이러한 감정을 인식하고, 필요한 지원을 요청하는 것이 중요합니다."
내원이유/상담,이러다 우울증 걸릴 것 같아서 일단 상담 받으려고 와봤어요.,"우울증의 징후를 인식하는 것은 중요한 첫 걸음입니다. 필요한 지원을 요청하고, 전문가의 도움을 받는 것이 중요합니다."
내원이유/의사소견,근데 선생님이 정신과 상담 권유하셔서… 그래서 와 봤어요.,"전문적인 도움을 받는 것은 치유의 중요한 과정입니다. 이 감정을 솔직하게 드러내고, 필요한 지원을 요청하는 것이 중요합니다."
내원이유/의사소견,선생님이 정신과 한 번 가보라고 하셔서 오긴 왔어요.,"정신적 건강에 대한 관심은 중요합니다. 필요한 지원을 요청하고, 전문가의 도움을 받는 것이 중요합니다."
내원이유/의사소견,선생님도 내 말 듣더니 그럼 정신과 가보시라고 해서…,전문가의 조언은 자신을 이해하는 데 큰 도움이 될 수 있습니다. 필요한 지원을 요청하는 것이 중요합니다.
내원이유/의사소견,근데 선생님이 정신과 한 번 가보라고 하셔서 일단 와봤어요.,"정신적 건강에 대한 관심은 매우 중요합니다. 필요한 지원을 요청하고, 전문가의 도움을 받는 것이 필요합니다."
내원이유/의사소견,근데 일단 의사가 정신과 가보래서 왔어… 나 진짜 아픈 건가?,"자신의 감정을 이해하고, 전문적인 도움을 받는 것은 중요한 과정입니다. 필요한 지원을 요청하는 것이 중요합니다."
내원이유/치료,지금 방학했으니까 아예 한국에서 치료 받으려고 왔어요.,치료를 받기 위한 결정은 자신의 건강을 소중히 여기는 좋은 선택입니다. 필요한 지원을 요청하는 것이 중요합니다.
내원이유/치료,이게 아무래도 제 정신적인 문제 같아서 치료 받으러 왔어요.,"정신적 문제를 인식하고, 치료를 받는 것은 치유의 좋은 첫 걸음입니다. 필요한 지원을 요청하는 것이 중요합니다."
내원이유/치료,어떻게 뭔 치료가 없을까 해서 그거 알아보다가 왔어요.,치료 방법을 찾아보는 것은 자신의 건강을 위한 중요한 과정입니다. 필요한 지원을 요청하는 것이 중요합니다.
내원이유/치료,이 버릇 좀 어떻게 고치고 싶어서 와봤어요.,변화의 의지가 있는 것은 긍정적인 시작입니다. 전문가의 도움을 받아 변화의 과정을 모색하는 것이 필요합니다.
내원이유/치료,이런 거 말고 뭔가 근본적인 치료를 하고 싶어서 왔어요.,"근본적인 치유를 추구하는 것은 매우 중요합니다. 필요한 지원을 요청하고, 전문가의 도움을 받는 것이 필요합니다."
모호함,그런데 살아보니까 그렇지도 않아요.,"삶의 현실은 때때로 우리의 기대와 다를 수 있습니다. 이 감정을 인식하고, 필요한 지원을 요청하는 것이 중요합니다."
모호함,그런데 지금은 아니야…,"현재의 감정을 인식하고, 필요한 지원을 요청하는 것이 중요합니다."
모호함,옥상에 올라가서 찬바람을 맞으니까 정신이 확 들었어요.,"자연의 힘은 때때로 우리의 감정을 정화하는 데 도움이 됩니다. 이러한 경험을 소중히 여기고, 자신을 돌보는 것이 필요합니다."
모호함,저게 대체 뭐길래 저 난리인가 싶었거든.,"삶의 복잡함을 이해하는 과정은 종종 우리의 감정을 탐구하게 만듭니다. 이 감정을 인식하고, 필요한 지원을 요청하는 것이 중요합니다."
모호함,지식인 보면 그런 사람 진짜 꽤 있는 것 같고.,"타인의 경험을 이해하는 것은 자신의 감정을 탐구하는 데 도움이 됩니다. 그러나 자신을 소중히 여기고, 필요한 지원을 요청하는 것이 중요합니다."
배경/가족,"누나가 혼내는 게 아니라, 다 이해한다고 그러는데 진심으로 고마웠어.","가족의 이해는 큰 위안이 될 수 있습니다. 이러한 지지를 소중히 여기고, 서로의 감정을 나누는 것이 중요합니다."
배경/가족,"남편이 4형제 중에 둘째인데, 시어머니가 남편을 별로 안 좋아하는 것 같아요.","가족 간의 관계는 종종 복잡합니다. 이 감정을 솔직하게 드러내고, 필요할 때 소통하는 것이 중요합니다."
배경/가족,"가족한테 말을 아직 안했지만, 제가 아무 말 없으니까 엄마도 아마 결과가 안 좋다는 건 아시는 것 같아요.","가족의 걱정은 깊은 사랑에서 비롯됩니다. 자신의 감정을 이해하고, 필요한 소통을 시도하는 것이 중요합니다."
배경/가족,그래도 가족인데 서로가 쓴 돈이 그렇게 아까운가…,"가족 간의 지원은 중요한 요소입니다. 그러나 각자의 상황을 이해하고, 소통하는 것이 필요합니다."
배경/가족,저 자식은 나이가 몇인데 아직도 정신을 못 차렸지?,"가족 간의 기대는 종종 갈등을 초래할 수 있습니다. 이 감정을 인식하고, 필요한 지원을 요청하는 것이 중요합니다."
배경/가족/갈등,나갔다가 들어왔더니 엄마가 뭐라는 줄 알아? ,"가족의 반응은 우리의 감정에 큰 영향을 미칩니다. 이 감정을 솔직하게 표현하고, 소통하는 것이 필요합니다."
배경/가족/갈등,"언니는 커튼을 자주 치는데, 제가 자꾸 못 하게 막으니까… 집에서 나가고 싶대요.","가족 간의 갈등은 종종 관계를 복잡하게 만들 수 있습니다. 이 감정을 수용하고, 대화를 통해 해결하는 것이 중요합니다."
배경/가족/갈등,새언니도 별로 잘난 건 없거든? ,"가족 내의 비교는 종종 갈등을 초래합니다. 이 감정을 인식하고, 서로의 가치를 존중하는 것이 필요합니다."
배경/가족/갈등,"아빠 없이 엄마, 누나랑 살았는데 그때 정말 많이 싸웠어.","과거의 갈등은 현재의 감정에 큰 영향을 미칠 수 있습니다. 이를 이해하고, 치유의 과정을 거치는 것이 중요합니다."
배경/가족/무관심,가족 중에 저한테 신경을 쓰는 사람이 없어요.,"고립감은 깊은 슬픔을 불러일으킬 수 있습니다. 그러나 자신의 감정을 이해하고, 필요한 지원을 요청하는 것이 중요합니다."
배경/가족/무관심,가족들이 아무도 저에게 관심이 없어요. 익숙해요.,"가족의 무관심은 고립감을 증폭시킬 수 있습니다. 이 감정을 인식하고, 필요한 소통을 시도하는 것이 중요합니다."
배경/가족/무관심,가족들 다 제가 뭘 어떻게 하고 다니든 관심이 없어요. 당연한 것 같아요.,"가족의 관심 부족은 우리에게 큰 상처가 될 수 있습니다. 이 감정을 솔직하게 드러내고, 필요한 지원을 요청하는 것이 중요합니다."
배경/가족/무관심,내가 아주 어릴 때부터 가정에 충실한 적이 없었어.,"과거의 경험은 우리의 정체성을 형성하는 중요한 요소입니다. 이를 이해하고, 필요한 변화의 과정을 모색하는 것이 중요합니다."
배경/가족/무관심,내 몸이 아프니까 애들이고 애아빠가 눈에 안 들어오네요.,"신체적 고통은 종종 우리의 감정에 큰 영향을 미칩니다. 이 감정을 인식하고, 필요한 지원을 요청하는 것이 중요합니다."
배경/건강문제,"한 2주 갔는데, 너무 몸이 안 좋아졌어요.","건강의 악화는 심리적 부담의 신호입니다. 이 감정을 수용하고, 필요한 지원을 요청하는 것이 중요합니다."
배경/건강문제,그거 때문에 병원도 계속 다니고 있고.,"지속적인 건강 문제는 우리의 감정에 영향을 미칠 수 있습니다. 이 감정을 이해하고, 필요한 지원을 요청하는 것이 중요합니다."
배경/건강문제,염증 때문에 병원에 자주 다니다 보니까 환자들을 많이 보게 돼.,"병원에서의 경험은 우리의 감정에 큰 영향을 미칠 수 있습니다. 이 감정을 인식하고, 필요한 지원을 요청하는 것이 중요합니다."
배경/건강문제,제가 원래 건강체질이거든요. 뼈도 통뼈고.,건강에 대한 자신감은 중요한 요소입니다. 그러나 변화에 대한 적응이 필요할 수 있습니다.
배경/건강문제,WPW증후군 진단 받았는데 심각한 것 같진 않아서 따로 치료를 받은 적은 없어요.,건강 문제에 대한 인식은 중요합니다. 그러나 필요한 경우 전문가의 도움을 받는 것이 중요합니다.
배경/건강문제/갑상선,근데 작년에 건강검진을 받아보니까 갑상선에 혹이 생겼대요.,"건강 검진 결과는 종종 불안을 초래할 수 있습니다. 이 감정을 수용하고, 필요한 지원을 요청하는 것이 중요합니다."
배경/건강문제/갑상선,병원에 가보니 갑상선에 문제가 생겼다고 하더라구요.,"갑상선 문제는 심리적 부담을 증가시킬 수 있습니다. 이 감정을 인식하고, 필요한 지원을 요청하는 것이 중요합니다."
배경/건강문제/갑상선,갑상선 수술은 잘 끝났고 이제 약물치료 할 거래.,치료 후 회복 과정은 중요한 단계입니다. 이 과정을 인내하며 기다리는 것이 필요합니다.
배경/건강문제/갑상선,인터넷에다가 검색을 좀 해보니까 갑상선에 문제가 있으면 비슷한 증상이 생기더라구.,정보 탐색은 우리의 불안을 줄이는 데 도움이 될 수 있습니다. 그러나 신뢰할 수 있는 정보를 바탕으로 판단하는 것이 중요합니다.
배경/건강문제/갑상선,갑상선 수술 이후에 약을 복용하고 있어요.,"약물 치료는 회복의 중요한 부분입니다. 필요한 지원을 요청하고, 전문가의 도움을 받는 것이 필요합니다."
배경/건강문제/다이어트,작년에 다이어트로 살을 20키로 정도 뺐어.,다이어트는 종종 우리의 자아에 큰 영향을 미칩니다. 그러나 건강을 최우선으로 생각하는 것이 필요합니다.
배경/건강문제/다이어트,무조건 굶어서 뺀 건 아니고 운동도 하고 식이도 했지.,"건강한 다이어트는 운동과 식이조절의 조화를 필요로 합니다. 이 과정을 소중히 여기고, 긍정적인 변화를 위한 방법을 모색하는 것이 중요합니다."
배경/건강문제/다이어트,어학연수 떠나기 전에 운동 빡시게 해서 6Kg을 뺐어요.,"목표를 설정하고 달성하는 것은 긍정적인 성취감을 가져다 줍니다. 이를 소중히 여기고, 자신을 격려하는 것이 필요합니다."
배경/건강문제/다이어트,몸무게 유지하려고 거기서는 과일만 먹었어요.,건강한 식습관은 우리의 정신적 건강에 중요한 요소입니다. 그러나 균형 잡힌 식사가 필요합니다.
배경/건강문제/다이어트,미국 음식이 워낙 짜고 해비하니까 먹으면 바로 살이 찔 거 같더라고요.,음식 선택은 우리의 건강에 큰 영향을 미칩니다. 그러나 자신에게 필요한 것을 찾아보는 것이 중요합니다.
배경/건강문제/다이어트/스트레스,졸업 사진 찍어야 해서 다이어트 한 지 두 달 됐어요.,"특정 목표를 위한 다이어트는 때때로 스트레스를 유발할 수 있습니다. 이 감정을 이해하고, 긍정적인 방법으로 대처하는 것이 필요합니다."
배경/건강문제/다이어트/스트레스,"살은 빠지긴 했는데, 그 이상 빠지질 않아서 스트레스에요.",다이어트의 정체는 종종 실망감을 초래할 수 있습니다. 그러나 긍정적인 변화를 위한 방법을 모색하는 것이 중요합니다.
배경/건강문제/다이어트/스트레스,저저번 달부터 다이어트 중이라 스트레스가 좀 많긴 했어.,"다이어트는 심리적 부담을 증가시킬 수 있습니다. 이 감정을 수용하고, 필요한 지원을 요청하는 것이 중요합니다."
배경/건강문제/다이어트/스트레스,특히 탄수화물을 못 먹으니까 죽을 것 같아. ,식이 제한은 종종 심리적 스트레스를 초래합니다. 균형 잡힌 식단을 찾는 것이 중요합니다.
배경/건강문제/다이어트/스트레스,다이어트 때문에 스트레스가 심해. 외모지상주의 세상이 싫어. ,"외모에 대한 압박감은 깊은 고통을 불러일으킬 수 있습니다. 그러나 자신의 가치를 재발견하고, 긍정적인 자아 이미지를 형성하는 것이 중요합니다."
배경/건강문제/생리불순,"원래 안 그랬는데, 최근 생리가 불규칙해져서 호르몬에 이상이 생긴 건 아닌지 걱정이 됐어요.","생리 불규칙은 종종 스트레스와 관련이 있습니다. 이 감정을 인식하고, 필요한 지원을 요청하는 것이 중요합니다."
배경/건강문제/생리불순,한 두 달 가까이 안 나오다가 2주 정도 연달아 할 때도 있고…,
배경/건강문제/생리불순,생리가 불규칙해. 어릴 때부터 그랬는데 요즘은 더 해.,"생리 주기의 변화는 종종 심리적 요인이나 건강 문제와 관련이 있습니다. 이를 인식하고, 전문가의 도움을 받는 것이 필요합니다."
배경/건강문제/생리불순,좀처럼 생리날짜를 종잡을 수가 없어.,생리전증후군의 부재는 불안감을 초래할 수 있습니다. 그러나 준비하는 것은 긍정적인 방법입니다.
배경/건강문제/생리불순,심지어 생리전증후군도 없어서 언제 시작할지 몰라서 항상 생리대를 들고 다녀.,"심각한 건강 문제는 큰 스트레스를 유발할 수 있습니다. 자신의 건강을 소중히 여기고, 필요한 지원을 요청하는 것이 중요합니다."
배경/건강문제/수술,몸살 난 것처럼 열나고 토하고 그래서 병원에 갔더니 심내막염? 그거라고 수술을 해야 한다는 거야. ,"수술 후 회복 과정은 중요한 단계입니다. 이 과정을 잘 이겨내고, 자신을 격려하는 것이 필요합니다."
배경/건강문제/수술,그땐 정말 죽는 줄 알았죠. 운이 좋았는지 수술도 잘 됐어요. 매년 병원가서 검사는 하고 있어요.,정기 검사는 건강 유지에 매우 중요합니다. 자신의 건강 상태를 잘 관리하는 것이 필요합니다.
배경/건강문제/수술,이마가 찢어져서 5바늘 쯤 꿰맸어요.,부상의 치료 과정은 종종 고통스러운 경험입니다. 그러나 회복을 통해 강해질 수 있습니다.
배경/건강문제/수술,뭐 크기가 크지는 않다고 해서… 바로 수술을 받았죠.,"신속한 판단은 때때로 중요한 결과를 가져올 수 있습니다. 이 감정을 인식하고, 필요한 지원을 요청하는 것이 중요합니다."
배경/건강문제/수술,수술 무사히 끝나고 집으로 돌아왔어요.,"수술 후 회복은 중요한 과정입니다. 자신을 돌보고, 필요한 지원을 요청하는 것이 필요합니다."
배경/건강문제/알레르기,작년 이맘때도 알러지 때문에 고생했어.,"알레르기는 심리적 부담을 증가시킬 수 있습니다. 이 감정을 수용하고, 필요한 조치를 취하는 것이 중요합니다."
배경/건강문제/알레르기,저 꽃가루 알러지가 심해서 매년 고생하거든요.,"계절성 알레르기는 종종 큰 스트레스를 초래할 수 있습니다. 이 감정을 이해하고, 필요한 지원을 요청하는 것이 중요합니다."
배경/건강문제/알레르기,올해도 봄이 되니까 눈이 딱 가렵더라고요.,"계절적 변화는 알레르기의 증상을 악화시킬 수 있습니다. 이 감정을 인식하고, 관리하는 방법을 찾아보세요."
배경/건강문제/알레르기,봄만 되면 꽃가루 알레르기 때문에 미칠 것 같아요.,"알레르기 증상은 우리의 정신적 건강에 큰 영향을 미칠 수 있습니다. 이 감정을 인식하고, 필요한 지원을 요청하는 것이 중요합니다."
배경/건강문제/알레르기,알레르기 때문에 작년에도 고생이 많았어요.,"지속적인 알레르기 문제는 심리적 부담을 증가시킬 수 있습니다. 필요한 지원을 요청하고, 관리 방법을 찾아보는 것이 중요합니다."
배경/건강문제/항암,수술 끝나고 항암 치료 진행 중이에요.,"항암 치료는 큰 스트레스를 동반할 수 있습니다. 이 과정을 잘 이겨내고, 필요한 지원을 요청하는 것이 중요합니다."
배경/건강문제/항암,아직도 항암이 4번이나 더 남았어…,치료 과정은 어려운 시간이 될 수 있습니다. 그러나 긍정적인 마음가짐을 유지하는 것이 중요합니다.
배경/건강문제/항암,항암 치료를 이어나가고 있긴 한데… 기대는 크지 않아.,"치료의 불확실성은 큰 스트레스를 유발할 수 있습니다. 이 감정을 이해하고, 필요한 지원을 요청하는 것이 중요합니다."
배경/건강문제/항암,항암 치료라는 게 나는 그렇게 고통스러운 건 줄은 몰랐어.,"항암 치료의 고통은 종종 예기치 않은 경험입니다. 이 감정을 수용하고, 필요할 때 도움을 요청하는 것이 중요합니다."
배경/건강문제/항암,어제 마지막 항암 치료를 받았어요.,"마지막 치료는 중요한 이정표입니다. 이 과정을 잘 이겨내고, 자신을 격려하는 것이 필요합니다."
배경/결혼,"암튼 결혼해서 지금 애 하나 있고, 초등학생이에요.","가족의 존재는 큰 힘이 될 수 있습니다. 그러나 자신의 상황을 이해하고, 필요한 지원을 찾는 것이 중요합니다."
배경/결혼,사실 결혼한 지 한 달 밖에 안됐는데… 신혼인데 왜 그런지 모르겠어요.,신혼의 감정은 복잡할 수 있습니다. 서로의 감정을 솔직하게 나누는 것이 중요합니다.
배경/결혼,결혼식 하고 일주일이나 지났나? ,"결혼 후의 변화는 종종 혼란을 일으킬 수 있습니다. 이 감정을 인식하고, 필요한 지원을 요청하는 것이 중요합니다."
배경/결혼,연애 결혼이 아니어서 그런가?,"결혼의 형태는 우리의 감정에 큰 영향을 미칠 수 있습니다. 서로의 감정을 이해하고, 소통하는 것이 필요합니다."
배경/결혼,결혼도 엄청 빨랐어요. 만난 지 3개월 만에 했으니까.,"빠른 결혼은 종종 불안감을 초래할 수 있습니다. 이 감정을 인식하고, 필요한 지원을 요청하는 것이 중요합니다."
배경/결혼/미혼,나이 마흔 둘인데 아직 결혼 안 했어. ,"결혼의 시기는 개인마다 다릅니다. 자신의 선택을 존중하고, 필요한 지원을 찾는 것이 중요합니다."
배경/결혼/미혼,"비혼주의자는 아닌데, 사람 만날 인연이 없었나봐. ","인연은 종종 예기치 않게 찾아옵니다. 그러나 자신의 감정을 이해하고, 필요한 지원을 요청하는 것이 중요합니다."
배경/결혼/미혼,딱히 결혼할 생각은 없어.,"결혼에 대한 생각은 개인의 선택입니다. 자신의 삶의 방향을 찾고, 긍정적인 변화를 위한 방법을 모색하는 것이 중요합니다."
배경/결혼/미혼,웬만하면 계속 혼자 살려고 해.,"혼자의 삶도 소중한 선택입니다. 자신의 가치를 이해하고, 필요한 지원을 요청하는 것이 중요합니다."
배경/결혼/미혼,결혼을 해야 하는 이유를 잘 모르겠어. ,"결혼의 의미는 개인마다 다릅니다. 자신의 가치를 재발견하고, 소중히 여기는 것이 필요합니다."
배경/경제적문제,"제가 직업이 좋은 것도 아니고.. 금수저 집안도 아니고, 아직 갚을 대출도 있는데, 버는 돈은 똑같고…",경제적 상황은 결혼에 대한 고민을 증가시킬 수 있습니다. 그러나 자신의 가치와 목표를 이해하는 것이 중요합니다.
배경/경제적문제,근데 뭐 내가 벌이가 있어야 말이지. ,"경제적 자립은 중요한 요소입니다. 자신의 목표를 설정하고, 긍정적인 방향으로 나아가는 것이 필요합니다."
배경/경제적문제,빚이 무섭게 불어나더라.,"빚의 증가로 인한 스트레스는 심리적 부담을 증가시킬 수 있습니다. 이 감정을 인식하고, 필요한 지원을 요청하는 것이 중요합니다."
배경/경제적문제,여차하면 팔아서 반반 나눠야겠다고 생각을 하고 있었죠.,"경제적 불확실성은 종종 큰 스트레스를 초래합니다. 이 감정을 수용하고, 필요한 지원을 요청하는 것이 중요합니다."
배경/경제적문제,집안 형편이 안 좋아.,"가정의 경제적 상황은 우리의 감정에 큰 영향을 미칠 수 있습니다. 이 감정을 인식하고, 필요한 지원을 요청하는 것이 중요합니다."
배경/경제적문제/가난,얼마나 가난했냐면 정말 급식비 낼 돈도 없었거든. 진짜로.,"가난한 경험은 우리의 정체성을 형성하는 중요한 요소입니다. 이를 이해하고, 필요한 지원을 요청하는 것이 중요합니다."
배경/경제적문제/가난,그걸로 동생들 뒷바라지 다 하고… 어렵게 살았죠.,"가족을 돌보는 책임은 큰 부담이 될 수 있습니다. 이 감정을 수용하고, 필요한 지원을 요청하는 것이 중요합니다."
배경/경제적문제/가난,우리집이 예전에 되게 가난했단 말이야.,"과거의 경제적 어려움은 우리의 정체성과 감정에 큰 영향을 미칩니다. 이를 인식하고, 필요한 지원을 요청하는 것이 중요합니다."
배경/경제적문제/가난,형이 취직하고 나서는 국가지원이 바로 끊겼어. 그래서 또 한동안 라면만 먹고.,"가족의 경제적 상황은 종종 큰 스트레스를 유발합니다. 이 감정을 수용하고, 필요할 때 지원을 요청하는 것이 중요합니다."
배경/경제적문제/가난,그걸로 동생들 뒷바라지 다 하고 어렵게 살았죠.,"가족을 돌보는 책임은 큰 부담이 될 수 있습니다. 이 감정을 인식하고, 필요한 지원을 요청하는 것이 중요합니다."
배경/경제적문제/빚,심지어 못 갚을 상황이 됐다고… 그게 우리가 갚아야 되는 돈이 됐다네요?,"재정적 압박감은 심리적 부담을 증가시킬 수 있습니다. 이 감정을 이해하고, 필요한 지원을 요청하는 것이 중요합니다."
배경/경제적문제/빚,그래도 어느 정도 내 능력을 믿고 막 썼어. 금방 갚을 수 있을 거라는 뭐… 그런 마음이었지.,자신에 대한 믿음은 중요한 요소입니다. 그러나 재정적 계획을 세우는 것이 필요합니다.
배경/경제적문제/빚,돈이 없을 때는 현금서비스를 받아서 근근이 살아.,"재정적 어려움은 우리의 삶을 어렵게 할 수 있습니다. 이 감정을 인식하고, 필요한 지원을 요청하는 것이 중요합니다."
배경/경제적문제/빚,빚이 8억이래요…,"큰 빚은 심리적 부담을 증가시킬 수 있습니다. 이 감정을 이해하고, 재정적 계획을 세우는 것이 필요합니다."
배경/경제적문제/빚,돈 버는 걸로 부족해서 카드 빚도 냈는데…끊을 수가 없어.,"카드 빚은 종종 재정적 스트레스를 유발합니다. 이 감정을 인식하고, 필요한 지원을 요청하는 것이 중요합니다."
배경/공부,독한 마음 먹으니까 영어가 빠르게 늘더라고요.,"목표를 설정하고 집중하는 것은 긍정적인 결과를 가져올 수 있습니다. 이 과정을 소중히 여기고, 자신을 격려하는 것이 필요합니다."
배경/공부,그 생각도 나고… 여러모로 배울 게 많을 거 같았어.,"배움은 우리의 성장에 중요한 요소입니다. 긍정적인 태도를 유지하고, 필요한 지원을 요청하는 것이 중요합니다."
배경/공부,나는 새벽에 공부하는 편이라 항상 늦게까지 공부한단 말이야.,공부의 패턴은 개인에 따라 다릅니다. 자신에게 맞는 방법을 찾아가는 것이 중요합니다.
